{
  "$schema": "http://json-schema.org/draft-07/schema#",
  "title": "Dyson Sphere Program Recipes",
  "description": "配方数据 Schema",
  "type": "array",
  "items": {
    "type": "object",
    "required": ["s", "m"],
    "properties": {
      "s": {
        "type": "array",
        "description": "产物列表",
        "items": {
          "type": "object",
          "required": ["name"],
          "properties": {
            "name": {
              "type": "string",
              "description": "产物名称"
            },
            "n": {
              "type": "number",
              "description": "数量，默认1"
            }
          }
        }
      },
      "q": {
        "type": "array",
        "description": "原料列表",
        "items": {
          "type": "object",
          "required": ["name"],
          "properties": {
            "name": {
              "type": "string",
              "description": "原料名称"
            },
            "n": {
              "type": "number",
              "description": "数量"
            }
          }
        }
      },
      "t": {
        "type": "number",
        "description": "生产时间(秒)"
      },
      "m": {
        "type": "string",
        "description": "生产设备"
      },
      "group": {
        "type": "string",
        "description": "分组"
      },
      "noExtra": {
        "type": ["boolean", "null"],
        "description": "增产剂效果: false=加速/增产, true=加速, null=无效果"
      }
    }
  }
}
