[
  {
    "s": [
      {
        "name": "宇宙矩阵"
      }
    ],
    "q": [
      {
        "name": "蓝矩阵",
        "n": 1
      },
      {
        "name": "红矩阵",
        "n": 1
      },
      {
        "name": "黄矩阵",
        "n": 1
      },
      {
        "name": "紫矩阵",
        "n": 1
      },
      {
        "name": "绿矩阵",
        "n": 1
      },
      {
        "name": "反物质",
        "n": 1
      }
    ],
    "t": 15,
    "m": "研究站",
    "group": "产品"
  },
  {
    "s": [
      {
        "name": "铁矿"
      }
    ],
    "q": [],
    "m": "采矿机",
    "t": 1
  },
  {
    "s": [
      {
        "name": "铜矿"
      }
    ],
    "q": [],
    "m": "采矿机",
    "t": 1
  },
  {
    "s": [
      {
        "name": "煤矿"
      }
    ],
    "q": [],
    "m": "采矿机",
    "t": 1
  },
  {
    "s": [
      {
        "name": "石矿"
      }
    ],
    "q": [],
    "m": "采矿机",
    "t": 1
  },
  {
    "s": [
      {
        "name": "钛石"
      }
    ],
    "q": [],
    "m": "采矿机",
    "t": 1
  },
  {
    "s": [
      {
        "name": "原油"
      }
    ],
    "q": [],
    "m": "原油萃取站",
    "t": 1
  },
  {
    "s": [
      {
        "name": "水"
      }
    ],
    "q": [],
    "m": "抽水机",
    "t": 1
  },
  {
    "s": [
      {
        "name": "硅石"
      }
    ],
    "q": [],
    "m": "采矿机",
    "t": 1
  },
  {
    "s": [
      {
        "name": "蓄电池满"
      }
    ],
    "q": [
      {
        "name": "蓄电池"
      }
    ],
    "m": "能量枢纽",
    "t": 1,
    "noExtra": null
  },
  {
    "s": [
      {
        "name": "蓝矩阵"
      }
    ],
    "q": [
      {
        "name": "磁线圈",
        "n": 1
      },
      {
        "name": "电路板",
        "n": 1
      }
    ],
    "t": 3,
    "m": "研究站",
    "group": "产品"
  },
  {
    "s": [
      {
        "name": "红矩阵"
      }
    ],
    "q": [
      {
        "name": "高级石墨",
        "n": 2
      },
      {
        "name": "氢",
        "n": 2
      }
    ],
    "t": 6,
    "m": "研究站",
    "group": "产品"
  },
  {
    "s": [
      {
        "name": "黄矩阵"
      }
    ],
    "q": [
      {
        "name": "金刚石",
        "n": 1
      },
      {
        "name": "钛晶石",
        "n": 1
      }
    ],
    "t": 8,
    "m": "研究站",
    "group": "产品"
  },
  {
    "s": [
      {
        "name": "紫矩阵"
      }
    ],
    "q": [
      {
        "name": "处理器",
        "n": 2
      },
      {
        "name": "粒子带宽",
        "n": 1
      }
    ],
    "t": 10,
    "m": "研究站",
    "group": "产品"
  },
  {
    "s": [
      {
        "name": "绿矩阵",
        "n": 2
      }
    ],
    "q": [
      {
        "name": "量子芯片",
        "n": 1
      },
      {
        "name": "引力透镜",
        "n": 1
      }
    ],
    "t": 24,
    "m": "研究站",
    "group": "产品"
  },
  {
    "s": [
      {
        "name": "空间翘曲器",
        "n": 8
      }
    ],
    "group": "消耗品",
    "m": "制作台",
    "q": [
      {
        "name": "绿矩阵",
        "n": 1
      }
    ],
    "t": 10
  },
  {
    "s": [
      {
        "name": "空间翘曲器",
        "n": 1
      }
    ],
    "group": "消耗品",
    "m": "制作台",
    "q": [
      {
        "name": "引力透镜",
        "n": 1
      }
    ],
    "t": 10
  },
  {
    "s": [
      {
        "name": "氘核燃料棒",
        "n": 2
      }
    ],
    "group": "消耗品",
    "m": "制作台",
    "q": [
      {
        "name": "钛合金",
        "n": 1
      },
      {
        "name": "重氢",
        "n": 20
      },
      {
        "name": "超级磁场环",
        "n": 1
      }
    ],
    "t": 12
  },
  {
    "s": [
      {
        "name": "引力透镜",
        "n": 1
      }
    ],
    "group": "消耗品",
    "m": "制作台",
    "q": [
      {
        "name": "金刚石",
        "n": 4
      },
      {
        "name": "奇异物质",
        "n": 1
      }
    ],
    "t": 6
  },
  {
    "s": [
      {
        "name": "硅石"
      }
    ],
    "q": [
      {
        "name": "石矿",
        "n": 10
      }
    ],
    "m": "冶炼设备",
    "t": 10
  },
  {
    "s": [
      {
        "name": "铁块"
      }
    ],
    "group": "组件",
    "m": "冶炼设备",
    "q": [
      {
        "name": "铁矿",
        "n": 1
      }
    ],
    "t": 1
  },
  {
    "s": [
      {
        "name": "钢材"
      }
    ],
    "group": "组件",
    "m": "冶炼设备",
    "q": [
      {
        "name": "铁块",
        "n": 3
      }
    ],
    "t": 3
  },
  {
    "s": [
      {
        "name": "钛块"
      }
    ],
    "group": "组件",
    "m": "冶炼设备",
    "q": [
      {
        "name": "钛石",
        "n": 2
      }
    ],
    "t": 2
  },
  {
    "s": [
      {
        "name": "铜块"
      }
    ],
    "group": "组件",
    "m": "冶炼设备",
    "q": [
      {
        "name": "铜矿",
        "n": 1
      }
    ],
    "t": 1
  },
  {
    "s": [
      {
        "name": "磁铁"
      }
    ],
    "group": "组件",
    "m": "冶炼设备",
    "q": [
      {
        "name": "铁矿",
        "n": 1
      }
    ],
    "t": 1.5
  },
  {
    "s": [
      {
        "name": "磁线圈",
        "n": 2
      }
    ],
    "group": "组件",
    "m": "制作台",
    "q": [
      {
        "name": "磁铁",
        "n": 2
      },
      {
        "name": "铜块",
        "n": 1
      }
    ],
    "t": 1
  },
  {
    "s": [
      {
        "name": "电路板",
        "n": 2
      }
    ],
    "group": "组件",
    "m": "制作台",
    "q": [
      {
        "name": "铁块",
        "n": 2
      },
      {
        "name": "铜块",
        "n": 1
      }
    ],
    "t": 1
  },
  {
    "s": [
      {
        "name": "齿轮"
      }
    ],
    "group": "组件",
    "m": "制作台",
    "q": [
      {
        "name": "铁块",
        "n": 1
      }
    ],
    "t": 1
  },
  {
    "s": [
      {
        "name": "高级石墨"
      }
    ],
    "group": "组件",
    "m": "冶炼设备",
    "q": [
      {
        "name": "煤矿",
        "n": 2
      }
    ],
    "t": 2
  },
  {
    "s": [
      {
        "name": "重氢"
      }
    ],
    "group": "组件",
    "m": "轨道采集器2",
    "q": [],
    "t": 1,
    "noExtra": true
  },
  {
    "s": [
      {
        "name": "氢"
      }
    ],
    "group": "组件",
    "m": "轨道采集器",
    "q": [],
    "t": 1,
    "noExtra": true
  },
  {
    "s": [
      {
        "name": "氢"
      }
    ],
    "group": "组件",
    "m": "轨道采集器2",
    "q": [],
    "t": 1
  },
  {
    "s": [
      {
        "name": "氢"
      },
      {
        "name": "精炼油",
        "n": 2
      }
    ],
    "group": "组件",
    "m": "原油精炼机",
    "q": [
      {
        "name": "原油",
        "n": 2
      }
    ],
    "t": 4
  },
  {
    "s": [
      {
        "name": "精炼油",
        "n": 3
      }
    ],
    "group": "组件",
    "m": "原油精炼机",
    "q": [
      {
        "name": "精炼油",
        "n": 2
      },
      {
        "name": "氢",
        "n": 1
      },
      {
        "name": "煤矿",
        "n": 1
      }
    ],
    "t": 4,
    "noExtra": true
  },
  {
    "s": [
      {
        "name": "氢",
        "n": 1
      },
      {
        "name": "石墨烯",
        "n": 2
      }
    ],
    "group": "组件",
    "m": "化工设备",
    "q": [
      {
        "name": "可燃冰",
        "n": 2
      }
    ],
    "t": 2
  },
  {
    "s": [
      {
        "name": "可燃冰"
      }
    ],
    "group": "组件",
    "m": "轨道采集器",
    "q": [],
    "t": 1
  },
  {
    "s": [
      {
        "name": "可燃冰"
      }
    ],
    "group": "组件",
    "m": "采矿机",
    "q": [],
    "t": 1
  },
  {
    "s": [
      {
        "name": "刺笋结晶"
      }
    ],
    "group": "组件",
    "m": "采矿机",
    "q": [],
    "t": 1
  },
  {
    "s": [
      {
        "name": "玻璃",
        "n": 1
      }
    ],
    "group": "组件",
    "m": "冶炼设备",
    "q": [
      {
        "name": "石矿",
        "n": 2
      }
    ],
    "t": 2
  },
  {
    "s": [
      {
        "name": "棱镜",
        "n": 2
      }
    ],
    "group": "组件",
    "m": "制作台",
    "q": [
      {
        "name": "玻璃",
        "n": 3
      }
    ],
    "t": 2
  },
  {
    "s": [
      {
        "name": "高纯硅块",
        "n": 1
      }
    ],
    "group": "组件",
    "m": "冶炼设备",
    "q": [
      {
        "name": "硅石",
        "n": 2
      }
    ],
    "t": 2
  },
  {
    "s": [
      {
        "name": "微晶元件",
        "n": 1
      }
    ],
    "group": "组件",
    "m": "制作台",
    "q": [
      {
        "name": "高纯硅块",
        "n": 2
      },
      {
        "name": "铜块",
        "n": 1
      }
    ],
    "t": 2
  },
  {
    "s": [
      {
        "name": "处理器",
        "n": 1
      }
    ],
    "group": "组件",
    "m": "制作台",
    "q": [
      {
        "name": "电路板",
        "n": 2
      },
      {
        "name": "微晶元件",
        "n": 2
      }
    ],
    "t": 3
  },
  {
    "s": [
      {
        "name": "金刚石",
        "n": 1
      }
    ],
    "group": "组件",
    "m": "冶炼设备",
    "q": [
      {
        "name": "高级石墨",
        "n": 1
      }
    ],
    "t": 2
  },
  {
    "s": [
      {
        "name": "塑料",
        "n": 1
      }
    ],
    "group": "组件",
    "m": "化工设备",
    "q": [
      {
        "name": "精炼油",
        "n": 2
      },
      {
        "name": "高级石墨",
        "n": 1
      }
    ],
    "t": 3
  },
  {
    "s": [
      {
        "name": "有机晶体",
        "n": 1
      }
    ],
    "group": "组件",
    "m": "化工设备",
    "q": [
      {
        "name": "塑料",
        "n": 2
      },
      {
        "name": "精炼油",
        "n": 1
      },
      {
        "name": "水",
        "n": 1
      }
    ],
    "t": 6
  },
  {
    "s": [
      {
        "name": "有机晶体"
      }
    ],
    "group": "组件",
    "m": "采矿机",
    "q": [],
    "t": 1
  },
  {
    "s": [
      {
        "name": "钛晶石",
        "n": 1
      }
    ],
    "group": "组件",
    "m": "制作台",
    "q": [
      {
        "name": "有机晶体",
        "n": 1
      },
      {
        "name": "钛块",
        "n": 3
      }
    ],
    "t": 4
  },
  {
    "s": [
      {
        "name": "晶格硅",
        "n": 1
      }
    ],
    "group": "组件",
    "m": "冶炼设备",
    "q": [
      {
        "name": "高纯硅块",
        "n": 1
      }
    ],
    "t": 2
  },
  {
    "s": [
      {
        "name": "石材",
        "n": 1
      }
    ],
    "group": "组件",
    "m": "冶炼设备",
    "q": [
      {
        "name": "石矿",
        "n": 1
      }
    ],
    "t": 1
  },
  {
    "s": [
      {
        "name": "电动机",
        "n": 1
      }
    ],
    "group": "组件",
    "m": "制作台",
    "q": [
      {